{
  "schema_version": "0.2.0",
  "work_item_id": "editing-flow",
  "team_id": "commerce-demo-team",
  "title": "Deliver the catalog editing flow",
  "outcome": "A user can complete the canonical fictional catalog edit transaction and see the saved result.",
  "status": "product_acceptance",
  "owner_role_id": "prototype-builder",
  "supporting_role_ids": [
    "experience-reviewer",
    "verifier"
  ],
  "dependencies": [
    "catalog-foundation"
  ],
  "acceptance": {
    "product_experience": "pending",
    "technical_review": "pending",
    "delivery_readiness": "pending",
    "merge_authorization": "pending"
  },
  "evidence": [
    {
      "claim": "The implementer self-check completes the canonical fictional edit transaction.",
      "artifact": "Recorded implementer self-check",
      "result": "pass"
    }
  ],
  "created_at": "2026-09-01T00:30:00Z",
  "updated_at": "2026-09-01T01:00:00Z"
}
